{
  "ward": "Minato-ku",
  "version": "2025-10-28",
  "pickups": [
    {
      "day": "Mon",
      "type": "burnable"
    },
    {
      "day": "Tue",
      "type": "plastic"
    },
    {
      "day": "Wed",
      "type": "burnable"
    },
    {
      "day": "Thu",
      "type": "cans"
    },
    {
      "day": "Fri",
      "type": "paper"
    }
  ],
  "bulkyFees": [
    {
      "item": "Small table",
      "feeYen": 800
    },
    {
      "item": "Office chair",
      "feeYen": 1200
    },
    {
      "item": "Bicycle",
      "feeYen": 2000,
      "notes": "without battery"
    }
  ],
  "source": "official ward PDF"
}
